{
  "schema_version": "mingsky-narrative-output.v1",
  "title": "在时间未知时，先看稳定而可信的主轴",
  "summary": "这份试读会保留清晰边界：不展开上升和宫位，只围绕稳定的行星与性格线索来解读。",
  "sections": [
    {
      "section_id": "guardrail_time_unknown",
      "type": "summary",
      "title": "时间未知的解读边界",
      "content": "因为缺少准确出生时间，这次不会把上升星座、宫位、天顶或依赖宫位的事业定位说成确定结论。我们先看太阳、月亮和可稳定判断的行星结构。",
      "evidence_refs": [
        "TIME_UNKNOWN",
        "HOUSES_UNRELIABLE"
      ]
    },
    {
      "section_id": "section_2",
      "type": "personality",
      "title": "稳定的性格主轴",
      "content": "你更适合先理解信息背后的结构，再决定怎么行动。这样的节奏让你不容易被表面情绪带走，也会让判断更有层次。",
      "evidence_refs": [
        "SUN_IN_AQUARIUS",
        "MOON_IN_SCORPIO",
        "TIME_UNKNOWN",
        "HOUSES_UNRELIABLE"
      ]
    },
    {
      "section_id": "section_3",
      "type": "personality",
      "title": "情绪表达需要安全感",
      "content": "你的感受并不浅，只是更需要经过内部整理。等你确认环境可靠，表达反而会更准确，也更有重量。",
      "evidence_refs": [
        "SUN_IN_AQUARIUS",
        "MOON_IN_SCORPIO",
        "TIME_UNKNOWN",
        "HOUSES_UNRELIABLE"
      ]
    },
    {
      "section_id": "section_4",
      "type": "cta",
      "title": "补充准确出生时间可解锁完整盘面",
      "content": "如果之后补充准确出生时间，完整版本会继续展开上升、宫位、事业轴线与更细的关系主题。",
      "evidence_refs": [
        "SUN_IN_AQUARIUS",
        "MOON_IN_SCORPIO",
        "TIME_UNKNOWN",
        "HOUSES_UNRELIABLE"
      ]
    }
  ]
}
